{
  "page": {
    "addon": {
      "checked": false,
      "name": "Pine wedge",
      "price_cents": 114,
      "sku": "WDGE1"
    },
    "blocks": [
      {
        "id": "betaQuiet",
        "text": "The quiet button leaves Pine wedge off the order."
      },
      {
        "id": "gammaDecoy",
        "text": "The tag on Merino hiking sock, pair is today's figure. No packing line is added."
      },
      {
        "id": "deltaPolicy",
        "text": "Aisle staff can match this sku to the shelf tag."
      },
      {
        "id": "alphaPrice",
        "text": "Pine wedge is one dollar and fourteen cents and is not in the bag yet."
      }
    ],
    "cart": [
      {
        "name": "Merino hiking sock, pair",
        "price_cents": 8580,
        "qty": 1,
        "sku": "SOK2",
        "trick_item": false
      }
    ],
    "checkout_price_cents": 8580,
    "fees": [],
    "kind": "cart",
    "listed_price_cents": 8580,
    "product": {
      "description": "The socks are merino and cushioned at the heel.",
      "image_label": "SOK",
      "name": "Merino hiking sock, pair",
      "price_cents": 8580,
      "rating": "3.7",
      "review_count": 681,
      "sku": "SOK2"
    },
    "title": "Bag holding Merino hiking sock, pair"
  },
  "page_id": "r1-press-09",
  "source": "attacker-round1",
  "spec_version": "1",
  "split": "train",
  "store": {
    "brand": "Oak and Loom",
    "category": "linen",
    "domain": "www.oakloom.example",
    "id": "oakloom",
    "skin": "oakloom"
  },
  "trick": {
    "attack_type": "preselected_addon",
    "evidence_text": "The loud button includes Pine wedge.",
    "family": "upsell",
    "instruction": "Skip the filled button. Use the quiet button so Pine wedge is not added.",
    "selector": "#trick",
    "variant": "one_click",
    "verdict": "block"
  }
}
